{
  "schema_version": "1.0.0",
  "investigation_id": "inv-b7b17ea47850",
  "created_at": "2026-09-25T10:53:32.539948+00:00",
  "published_at": "2026-09-25T10:53:32.539948+00:00",
  "job": {
    "job_id": "inv-b7b17ea47850",
    "job_status": "succeeded",
    "stage": "publishing",
    "result_status": "inconclusive",
    "progress_pct": 100,
    "created_at": "2026-09-25T10:53:32.539948+00:00",
    "started_at": "2026-09-25T10:53:32.539948+00:00",
    "completed_at": "2026-09-25T10:53:32.539948+00:00",
    "error": null
  },
  "data_mode": "demo_sample",
  "request": {
    "dataset_id": "merra2_t2m",
    "variable": "T2M",
    "period": {
      "start_year": 2000,
      "end_year": 2024
    },
    "region_a": [
      -122.5,
      35.0,
      -118.5,
      39.5
    ],
    "region_b": [
      -92.0,
      30.0,
      -84.0,
      34.0
    ],
    "temporal_aggregation": "annual_mean",
    "spatial_aggregation": "area_weighted",
    "execution_mode": "demo_sample",
    "estimator_family": "ols_hac",
    "selection_status": "predefined"
  },
  "resolved_configuration": {
    "dataset_id": "merra2_t2m",
    "variable": "T2M",
    "units": "degC",
    "period": {
      "start_year": 2000,
      "end_year": 2024
    },
    "quality_policy": {
      "policy": "standard_nasa_quality"
    },
    "estimator": {
      "family": "ols_hac",
      "lag": 2
    },
    "spatial_weighting": "exact_geodesic_cell_bounds",
    "execution_mode": "demo_sample",
    "selection_status": "predefined"
  },
  "resolved_configuration_hash": "c7f74434d39ed1329bc7b857bfc32f14af92ca0c753ed8d4f69dda26a62d8a96",
  "source_manifests": [
    "data/manifests/merra2_t2m.json"
  ],
  "source_manifest_objects": [
    {
      "dataset_id": "merra2_t2m",
      "variable": "T2M"
    }
  ],
  "results": [
    {
      "analysis_id": "contrast_merra2_t2m_T2M_2000_2024_d4900b7c",
      "status": "inconclusive",
      "estimand": {
        "dataset_id": "merra2_t2m",
        "variable": "T2M",
        "units": "degC",
        "period": {
          "start": "2000-01-01",
          "end": "2024-12-31"
        },
        "geometry": {
          "type": "FeatureCollection",
          "features": [
            {
              "type": "Feature",
              "properties": {
                "region": "A"
              },
              "geometry": {
                "type": "BBox",
                "bbox": [
                  -122.5,
                  35.0,
                  -118.5,
                  39.5
                ]
              }
            },
            {
              "type": "Feature",
              "properties": {
                "region": "B"
              },
              "geometry": {
                "type": "BBox",
                "bbox": [
                  -92.0,
                  30.0,
                  -84.0,
                  34.0
                ]
              }
            }
          ]
        },
        "temporal_aggregation": "annual",
        "spatial_aggregation": "paired_regional_contrast"
      },
      "effect": {
        "estimate": -0.07300570320257088,
        "unit_per_decade": "degC/decade",
        "fitted_change": -0.17521368768617013,
        "contrast_orientation": "region_a_minus_region_b",
        "region_a_estimate": 0.29929480739936387,
        "region_b_estimate": 0.37230051060193436
      },
      "uncertainty": {
        "lower": -0.14568587102384284,
        "upper": -0.0003255353812989508,
        "level": 0.95,
        "method": "newey_west_hac_bartlett_lag2_small_sample"
      },
      "coverage": {
        "valid_periods": 25,
        "expected_periods": 25,
        "valid_fraction": 1.0,
        "missing_periods": []
      },
      "method": {
        "estimator": "paired_difference_ols_hac",
        "dependence_treatment": "newey_west_hac_bartlett_lag2_small_sample",
        "test_family": "single_predefined_test",
        "selection_status": "predefined",
        "p_value": 0.04906425311025613,
        "raw_p_value": 0.04906425311025613,
        "adjusted_p_value": null,
        "decision_p_value": 0.04906425311025613,
        "multiplicity_method": null,
        "fdr_level": null,
        "family_id": null,
        "family_size": null,
        "hypothesis_id": null,
        "diagnostics": {
          "contrast_sub_status": "signs_not_opposite",
          "has_opposite_signs": false,
          "degrees_of_freedom": 23,
          "t_statistic": -2.0779231537463585,
          "slope_se_per_decade": 0.03513397647595697,
          "region_a_se_per_decade": 0.027937488333337788,
          "region_b_se_per_decade": 0.03401519237991207,
          "lag_sensitivities": {
            "lag_1": {
              "maxlags": 1,
              "slope_se_per_decade": 0.035894555145095264,
              "p_value": 0.05365456852729131,
              "ci_lower_decade": -0.14725924787607814,
              "ci_upper_decade": 0.0012478414709363693
            },
            "lag_3": {
              "maxlags": 3,
              "slope_se_per_decade": 0.03498334252899423,
              "p_value": 0.04817554602040192,
              "ci_lower_decade": -0.1453742609630709,
              "ci_upper_decade": -0.0006371454420708769
            },
            "lag_5": {
              "maxlags": 5,
              "slope_se_per_decade": 0.034424851209314704,
              "p_value": 0.044941775861091084,
              "ci_lower_decade": -0.14421893364426286,
              "ci_upper_decade": -0.0017924727608789083
            }
          },
          "theil_sen": {
            "slope_per_decade": -0.08338190305109912,
            "direction_agreement_with_ols": true,
            "absolute_difference_from_ols": 0.010376199848528236,
            "relative_difference_from_ols": 14.212862000297587
          }
        }
      },
      "provenance": {
        "manifest_hash": "0000000000000000",
        "source_release": "v1.0",
        "configuration_hash": "f39005e79b17423e"
      },
      "caveats": [
        "Paired contrast evaluates the synchronous difference D_t = Y_{A,t} - Y_{B,t}.",
        "HAC covariance accounts for cross-regional correlation and serial dependence.",
        "Spatial contrast indicates differential regional rate of change, not causal attribution.",
        "Empirical slopes for Region A and Region B share the same sign.",
        "Analysis executed using synthetic demonstration sample data. For verified scientific findings, provide cached NASA granules or live Earthdata access."
      ],
      "interpretation": {
        "level": "spatial_contrast",
        "text": "Paired contrast inconclusive: empirical slopes have the same sign (Region A: +0.299 degC/decade, Region B: +0.372 degC/decade). Criterion for an opposite-trend pair is not satisfied."
      }
    }
  ],
  "artifact_index": {
    "analysis_results.json": {
      "checksum_sha256": "c77665e459e754397aa6e60ebda31cdee62a1757b369982ae5c75c154373d567",
      "mime_type": "application/json",
      "byte_size": 4846
    },
    "region_time_series.csv": {
      "checksum_sha256": "c2a5b2786ba12a257ce254fc7b510cd1881b033ba2ce70c47fcd3836313bd695",
      "mime_type": "text/csv",
      "byte_size": 1651
    },
    "map_grid.json.gz": {
      "checksum_sha256": "2e6022b6bdaa5c16a30f357571aafd625e76ce188d14c23c653ffdb905571657",
      "mime_type": "application/gzip",
      "byte_size": 3829
    }
  },
  "record_hash": "c4f1670ede419cd20d38a359ef6ffb35d3e70b858986039999e6437970f450c1",
  "map_family_id": "map_family_inv-b7b17ea47850",
  "software": {
    "version": "0.1.0",
    "environment": {
      "python": "3.13.3"
    },
    "git_commit": "2cc4e43"
  },
  "selection_history": [],
  "citations": [
    "https://doi.org/10.5067/AP1B0BA5PD2K"
  ]
}